{
  "$schema": "https://json-schema.org/draft/2020-12/schema",
  "$id": "https://devbrief.local/schemas/transcript-fixture.schema.json",
  "title": "DevBrief redacted transcript fixture",
  "type": "object",
  "additionalProperties": false,
  "required": ["fixture_id", "fixture_version", "redacted", "segments"],
  "properties": {
    "fixture_id": {"type": "string", "minLength": 1},
    "fixture_version": {"type": "string", "minLength": 1},
    "redacted": {"const": true},
    "segments": {
      "type": "array",
      "minItems": 1,
      "items": {
        "type": "object",
        "additionalProperties": false,
        "required": ["segment_id", "start_ms", "end_ms", "speaker", "text"],
        "properties": {
          "segment_id": {"type": "string", "minLength": 1},
          "start_ms": {"type": "integer", "minimum": 0},
          "end_ms": {"type": "integer", "exclusiveMinimum": 0},
          "speaker": {"type": "string", "minLength": 1},
          "text": {"type": "string", "minLength": 1}
        }
      }
    }
  }
}
